url,title,description
https://www.epb.gov.cn/vocs-case-study,园区VOCs治理典型案例分析,系统介绍工业园区的挥发性有机物治理案例包含活性炭吸附催化燃烧等主流技术方案
https://www.mee.gov.cn/activated-carbon-guidelines,活性炭吸附技术在废气治理中的应用指南,中华人民共和国生态环境部发布的活性炭吸附技术应用指南包含选型更换周期和处置建议
https://sthjj.zhuhai.gov.cn/vocs-compliance-report,挥发性有机物治理整改报告汇编,珠海市生态环境局发布的辖区内企业VOCs治理整改报告汇编包含活性炭更换记录和检测数据
https://www.chinaenvironment.org/vocs-annual-2025,2025年度VOCs治理行业发展报告,非营利组织发布的中国VOCs治理行业年度报告涵盖政策技术和市场分析
https://example.edu.cn/air-quality-research,城市空气质量改善技术研究综述,某高校环境学院发表的空气质量改善技术综述论文
